{
  "schema_version": "crivo.experience-record/1.0.0",
  "experience_id": "exp-lume-ledger-concurrency-staleness",
  "project_id": "lume",
  "source_revision": "3f7299613c05d2519ac11860445642c3fccd4c1b",
  "context": {
    "domain": "Runtime Contextual Pessoal e Event Ledger",
    "language": "C++26",
    "platform": "Linux POSIX (Fedora Silverblue / Debian Embedded)",
    "components": ["sqlite3_wal", "reentrant_file_lock", "staleness_digest", "event_ledger"]
  },
  "problem": "Risco de corrupção de sequência monotônica sob concorrência multithread e risco de aplicação de propostas de planejamento temporal obsoletas quando o contexto de intenções sofre mutação após a geração da proposta.",
  "alternatives": [
    {
      "title": "Locks exclusivos sem reentrância e validação apenas por ID de intenção",
      "tradeoffs": "Simples, mas suscetível a deadlocks em chamadas aninhadas no mesmo processo e não detecta adição/remoção de intenções conflitantes no horizonte planejado.",
      "rejected_reason": "Inseguro contra deadlocks multithread e permite sobreposição de blocos quando novas intenções são inseridas durante a revisão da proposta."
    },
    {
      "title": "Lock reentrante thread-safe com fcntl + Verificação estrita de basis_intentions_digest na aplicação do plano",
      "tradeoffs": "Garante numeração estritamente monotônica sem lacunas ou deadlocks, e invalida deterministicamente propostas obsoletas (PLAN_STALE) se qualquer intenção divergir."
    }
  ],
  "choice": "Implementação de acquire_reentrant_lock associado a condition_variable por thread, PRAGMA busy_timeout=5000 no SQLite WAL, e cálculo de digest canônico das intenções abertas (basis_intentions_digest) registrado no evento EventPlanProposed e validado em apply_plan.",
  "procedure": "1. Proteger todas as transações com ledger_.with_exclusive_lock.\n2. Computar basis_intentions_digest antes de gerar a proposta.\n3. Persistir basis_intentions_digest e as_of_sequence no evento PLAN_PROPOSED no SQLite.\n4. Em apply_plan, recalcular o digest das intenções abertas e rejeitar com PLAN_STALE em caso de divergência.",
  "observed_result": "100% de sucesso no estresse concorrente de 6 threads e 240 eventos monotônicos, somado à qualificação das sete propriedades de staleness: snapshot canônico não vazio em trigger_automation e tick, as_of_sequence factual, criação direta de nova proposta pelo tick, PLAN_STALE após adição ou conclusão de intenções, aplicação com contexto inalterado e preservação após replay do Ledger.",
  "evidence_ref": {
    "evidence_id": "evidence-lume-2026-10-09T20:15:49Z-4b2a3980d653",
    "sha256": "4b2a3980d653984970f38445a1f674198af5ed635e4db2e040e72df5c6c99b3c",
    "path": ".run/evidence/evidence.json"
  },
  "applicability_tags": [
    "capability:sqlite",
    "sqlite:wal",
    "persistence:acid",
    "concurrency:posix_lock",
    "planning:staleness_digest",
    "monotonic_ledger",
    "runtime:cpp26"
  ],
  "limitations": "Requer sistema de arquivos local com suporte a POSIX fcntl locks e conformidade com transações SQLite WAL.",
  "created_at": "2026-10-09T19:30:22Z"
}
